chapter,chunk,text
17,13,"conceivable in India. A scheme for unemployment insurance would sacrifice the strong to the weak and the future to the present. Impoverished societies cannot subordinate the need for production to that of egalitarian distribution. Not that all inequalities are favourable to productivity. On the contrary, the excessive luxury of the rich is an economic as well as a moral scandal. But laws guaranteeing security to a minority of workers employed in factories, chosen at random among millions of unemployed, would be premature and unrealistic. Whether it is a question of values, of means or of the distant future, science does not forbid the play of ideas, but simply brings it down to reality. It preserves the intellectuals from nostalgia for the past and vain revolt against the present, and encourages them to think the world before aspiring to change it. No Asian country was so legitimately proud of its history and its culture as was China. None, for a century past, had been so deeply humiliated. Not that she was ever conquered: one does not conquer Chinaat most one can seize the throne as the Manchus did. The opium wars, the sacking of the Summer Palace, the foreign concessions, the one-sided treaties, the 'big-stick' policyall this has left a heritage of resentment which will be slow to disappear. The Communists, as soon as they came to power, destroyed the Christian communities in China; any strong government might well have acted in the same way, though perhaps with different methods. The traditional doctrine on which the age-old order of China was based was primarily moral and social. Confucianism justified the accession of men of letters to the exercise of administrative and governmental functions. The collapse of the empire brought about the ruin of the ideology. In India, the regeneration of Hinduism took place under the noses of the barbarians, under the protection of the Indian Civil Service. A renewal of Confucianism might have followed but could not have paved the way for China's return to the ranks of the great powers. The intellectuals who spontaneously went over to Communism before 1949 were only a small minority. The prestige of the Russian Revolution, which ever since 1920 had brought about the conversion of a few men of letters, was not basically distinguishable from that of other revolutionary ideas imported from Europe. The long years of war, the gradual corruption of the Kuomintang, the inflation, the severity of the police terror, alienated the intelligentsia and made them the natural allies of Mao Tse-tung. Can Communism, secular and materialist, become the doctrine of the Chinese intellectuals? The depreciation of the family and the boosting of the Party and the State represent a break with tradition, which only yesterday would have been considered totally impossible. But the Communist Party has nevertheless reconstituted a hierarchy at the summit of which scholars sit enthroned. Marxist-Leninists they call themselves today, and they are warriors as well as scholars a combination which had been unknown for centuries. Perhaps Western influence was needed to restore it: united against a hated foreign domination, the intellectuals of China rediscovered the old crusading fervour and, in winning their battle, allowed the West an ironic victory too: for the doctrine in whose name they threw out the barbarians belongs to the very essence of the West since it puts 'action' and 'history' in the forefront. The West has taught the people of Asia to re-think their past. Already in the nineteenth century, the basic theme of Russian philosophy was the contrast between the destiny of Russia and that of Europe. Marxism, in the Leninist version, offers to the intellectuals of all continents the means of reinterpreting their own history and that of their foreign masters without humiliation. The substitution of scientific truth for religious truth cannot but entail a spiritual crisis: it is difficult to be satisfied with a provisional truth, incontestable but limited, not guaranteed to console. Perhaps the lessons of historical knowledge are the most bitter, because they are ambiguous and fugitive, perpetually changing, perpetually being renewed. Marxism re-establishes an absolute. The doctrine which is now the official doctrine of China is not linked to the order of the cosmos or to the distinctive individuality of the Middle Kingdom; it is true because it reflects the order of change, which is irresistible and beneficent. Marxist-Leninism overcomes the relativism"
17,14,"which historical awareness inevitably brings with it, and heals the wounds inflicted, over the past century, by the technical superiority of Europe. One wonders if Asia will tomorrow show signs of the religious intolerance which Buddhism spared it but which was the scourge of the West, or if it will interpret the new faith in such a way that the heretics will be allowed to survive, despised perhaps but not forcibly converted or conquered on the pretext of conversion."
18,1,"CHAPTER IX THE INTELLECTUALS IN SEARCH OF A RELIGION PARALLELS between socialism and religion have frequently been drawn, and the diffusion of Christianity throughout the ancient world compared with that of Marxism in our time. The expression 'secular religion' has become a commonplace. Equally classic are the arguments arising from these comparisons. Does a Godless doctrine deserve to be called a religion? The faithful themselves deny the connection but insist that their belief is none-the-less compatible with the traditional faithare not the progressive Christians a living proof of the compatibility between Communism and Catholicism? In a sense, the quarrel is a verbal one. Everything depends on one's definition of the words involved. The doctrine provides true Communists with a global interpretation of the universe; it instils sentiments akin to those of the crusaders of all ages; it fixes the hierarchy of values and establishes the norms of good conduct. It fulfils, in the individual and in the collective soul, some of the functions which the sociologist normally ascribes to religions. As for the absence of the transcendental or the sacred, the Communists do not categorically deny it, but they recall that many societies throughout the centuries have been ignorant of the notion of a divine being without being ignorant of the way of thought and feeling, the obligations and the devotions, which the observer of today regards as religious.  I used the expression in two articles which appeared in La France Libre in June-July, 1944. These arguments side-step the real problem. One can define religion in such a way that it embraces the cults, rites and passions of the so-called primitive tribes, the teachings and practices of Confucianism and the sublime inspirations of Christ or Buddha, but what is the point, the meaning, of a secular religion in the West, in an environment impregnated with Christianity? Economic Opinion or Secular Religion Communism developed from an economic and political doctrine at a time when the spiritual vitality and the authority of the Churches were in decline. Passions which in other times might have expressed themselves in strictly religious beliefs were channelled into political action. Socialism appeared not so much a technique applicable to the management of enterprises or to the functioning of the economy, as a means of curing once and for all the age-old misery of mankind. The ideologies of the Right and of the Left, Fascism as well as Communism, are inspired by the modern philosophy of immanence. They are atheist, even when they do not deny the existence of God, to the extent that they conceive the human world without reference to the transcendental. According to La Berthonnière, Descartes, however good a Catholic he may have been, can be regarded as the initiator of this sort of atheism, since he was more interested in the conquest of nature than in meditation on the hereafter. The Marxists of the second or the third International are quite ready to allow that religion is a private affair, but they regard the organisation of the commonwealth as the only serious concern. Passions followed logically the transfer of the centre of interest. People no longer killed one another to determine which Church should be invested with the mission of interpreting the sacred scriptures and of administering the sacraments, but which party or which system offered the best chance of spreading material comfort for all in this vale of tears. Democracy and nationalism, it is true, have aroused no less passionate fervour than the classless society. At a time when the supreme values are linked to political reality, men are just as fanatical in their devotion to national independence as to an allegedly ideal order. In this vague sense, every political movement which has agitated modern Europe has had a religious character. Yet one does not find in them the framework or the essence of a religious philosophy. In this respect Communism is unique. The Marxist prophetism, as we have seen, conforms to the typical pattern of the Judeo-Christian prophetism. Every prophetism condemns what is and sketches an outline of what should or will be; it chooses an individual or a group to cleave a path across the no-man's land which separates the unworthy present from the radiant future. The classless society which will bring social progress without political revolution is comparable to the dreams of the millennium. The misery of the proletariat proves its vocation and the Communist Party becomes the Church which is opposed by the bourgeois  pagans who stop"
18,2,"their ears against the good tidings and by the socialist  Jews who have failed to recognise the Revolution which they themselves had been heralding for years. The recriminations and prognostications can be translated into rational terms. The forces of production, developed with the help of science harnessed to industry, do not yet provide decent conditions of life for more than a minority. Tomorrow the expansion of technology, combined with a change in the system of ownership and management, will bestow on all mankind the benefits of material plenty. It is an easy transition from the Marxist prophetism to 'the great hope of the twentieth century', from revolutionary faith to the theory of economic progress. How is it that the Marxist prophetism manages to oscillate between a reasonable opinion on the future of modern societies and a pseudo-religious dogma? How is it that it manages to inspire on the one hand the ideas and the methods of social democracy, which are those of common sense, peaceful reform and democratic liberty, and on the other hand the ideas and the methods of Communism, which are those of violence and revolution? In the first case, the theory is toned down and it is admitted that the work of regeneration demands the concurrence of all the victims of capitalism, of all those who, without suffering personally from the system, recognise its blemishes and desire to eliminate them. This does not mean that the vocation of the proletariat is eliminated; merely that it ceases to be exclusive. By their numbers and by their sufferings, the industrial workers are called upon to play a pre-eminent role in the humanisation of modern technological societies, but they are neither alone in suffering injustice nor alone in shaping the future. In the second case, the proletarian character of the collective saviour and of the party which represents it, is verbally emphasised and strengthened. Quite simply, the Party must be proclaimed the vanguard of the proletariat, however small the part which genuine flesh-and-blood industrial workers may take in the leadership and the activity of the party. The latter approximates to a Church, which is the trustee and guardian of the message of salvation. Whoever enters this Church at once receives its baptism: those genuine proletarians who refuse to follow it automatically debar themselves from the chosen class. Treading the first path, the prophetism reduces itself to a set of opinions which vary from nation to nation and are reasonably prosaic; Marxism is broken down into its elements historical hypotheses, economic preferences. The second way shows us the Party  Church stiffening doctrine into dogma and elaborating an interpretative scholasticism; imbued with passionate life, the Party  Church wins over immense cohorts. In order that the Communist system of interpretation shall never be found lacking, the delegation of the proletariat to the Party must be total and unreserved. This in turn makes it necessary to deny incontestable facts, to substitute for the real and multifarious conflicts of human life the stylised struggles of collective beings who are defined by their function in a pre-ordained destiny. From this arises the scholasticism which we have often come across in the course of the preceding pages, the interminable speculations on the infrastructure and the superstructure, the distinctions between subtle and vulgar meanings, the rejection of objectivity, and the re-writing of history. The social-democrats renounce this scholasticism; they do not seek to reconcile the facts with the predictions of yesterday, to enclose the countless riches of human societies in a narrow conceptual framework; but, by the same token, they forfeit the prestige bestowed by the system, the certainty and conviction, the transparent future. The Communists on the other hand seek to connect each episode in their development to the total course of history, and history itself to a philosophy of nature; there is nothing they do not know, they are never wrong, and the art of the dialectic enables them to harmonise any aspect of the Soviet reality with a doctrine that can be twisted in any direction. The combination of prophetism and scholasticism produces sentiments analogous to those of religious believers. Faith in the proletariat and in history, charity for those who suffer today and who tomorrow will inherit the earth, hope that the future will bring the advent of the classless society the theological virtues reappear in a new guise. But this faith is attached not so much to history as to a Church whose links with the Messiah have become"
18,3,"gradually loosened; this hope is placed in a future which, in default of being accomplished by spontaneous forces, will be produced by violence; this charity for suffering humanity hardens into indifference towards classes or nations or individuals condemned by the dialectic. Communist faith justifies all means, Communist hope forbids acceptance of the fact that there are many roads towards the Kingdom of God, Community charity does not even allow its enemies the right to die an honourable death. It is the psychology of a sect rather than of a universal Church. The militant is persuaded that he belongs to a small number of elect who are charged with the salvation of all. The faithful, accustomed to following the twists in the line, to repeating parrot-wise the successive and contradictory interpretations of the Nazi-Soviet pact, for example, or of the 'Doctors' Plot', become in a certain sense 'new men'. According to the materialist conception, men trained after a certain method are docile to authority and completely satisfied with their lot. The engineers of the soul have no doubts about the plastic nature of the psychic material at their disposal. At one extreme, socialism is reduced to a vague preference for the State control of the economy and for collective ownership; at the other extreme, it widens into a global system of interpretation which includes at once the entire cosmos and the ups and downs of civil strife in Guatemala. It will be said that the Communist faith is distinguishable from a politico-economic opinion only by its intransigence, that a new faith is always intransigent, and that Churches incline to tolerance as they become undermined by scepticism. But it is not simply a matter of intransigence: nothing comparable to the secular religion of Communism has arisen out of nationalism or democracy. One could call it fanaticism, if that is the right word to designate decrees by which a single party is transfigured into the guide of the world proletariat, a single system of interpretation superimposed on the unintelligible complexity of the facts, a single road to socialism proclaimed obligatory for all. Fanatical, surely, is the Communist who divides mankind into two camps according to their attitude towards the sacred cause, the militant who compels the bourgeoispagan to write his autobiography in conformity with the truth revealed by the proletarian State Militants and Sympathisers Communism is an ideology which, through the cult of the Party, the interpretative scholasticism manipulated by the revolutionary State, and the training and discipline enforced on the militants, has been transformed into a dogmatism of words and actions. Thus, one is tempted to take the concept of a secular religion either seriously or lightly according to whether one considers the point of departure or the point of arrival, the Marxism of 1890 or the Stalinism of 1950. There is no better illustration of this uncertainty than the tragic and turbulent history of the rivalry between socialists and communists. The latter, of course, have never had any doubts; ever since 1917 they have been denouncing their socialist brethren as traitors who went over to the capitalist camp as soon as they failed to recognise the Russian Revolution as the first step towards the fulfilment of the Marxist prophecies. The socialists, for their part, heartily denounce the cruelty of the Bolsheviks, the infamy of undemocratic socialism and the dictatorship over the proletariat. But they have never succeeded in quite overcoming a kind of guilt feeling: even if the road be horrible, is there another way? Are not socialists and communists both agreed in their opposition to capitalism, are they not equally hostile to the anarchy of the market and equally in favour of planning and collective ownership? When the Bolsheviks liquidated Mensheviks and Trotskyists, when the great purges raged or when peasants who were unwilling to accept collectivisation were deported by the million, the Western socialists, humanitarian, accustomed to parliamentary methods, reacted with horror and felt almost as remote from these ferocious organisers as from the fascists themselves, Stalin has only to die, and his successors to tone down some of the extreme and almost pathological manifestations of the system, to hold out the hand of friendship to the progressives and the Christians, for the social-democratic Marxists to start wondering again. Perhaps, when all is"
18,4,"said and done, the technique of despotism and five-year plans is the only one possible in Russia and other under-developed countries? The need for rapid industrialisation made the excesses of the terror inevitable, but the development of socialism will gradually eliminate the necessity for them. And with the democratisation of the Soviet régime the great schism will resolve itself. These alternations of trust and despair cannot simply be attributed to the inexhaustible naivety of the socialists, fated to end up in concentration camps under every sort of régime. They arise from the basic ambiguity of the secular religion. The latter, whether fascist or communist, is no more than the dogmatic hardening of opinions which are current in leftwing or right-wing circles. Consider, for example, the case of national-socialism. The man who sympathised with the Nazis in 1933 did not always believe in racialism; he might well have deplored the excesses of anti-Semitism, and simply affirmed the necessity of a strong government to re-establish the unity of the nation, to overcome partisan quarrels, to conduct a dynamic foreign policy. Such reserved allegiance does not only characterise the waverers or fellow-travellers; it is not unknown among those who actually belong to the party, sometimes even in the inner circles of the party. The faith of Goering was probably scarcely more orthodox than that of the old-fashioned nationalists who rallied round the brown-shirted demagogue out of pure opportunism. In 1955, how does the progressive Christian who is not a member of the Communist Party actually think and feel? If we revert to the book published by the worker-priests, we will find them adoptingsome of them at leastthe interpretation of events which is taught by the Party: ""The guides of the proletariat were right. The lessons of recent political and social events prove it: Marshall Plan, E. D. C. , unemployment, low salaries, Viet-Nam, Africa, poverty, housing shortage, illegality, repression"". To attribute to the Marshall Plan, which shortened by several years the period necessary for French economic reconstruction, a responsibility for poverty and low salaries represents a typical example of the substitution of dogma for facta substitution which is characteristic of Stalinist scholasticism. The worker-priests came to assimilate, perhaps without being precisely aware of it, the broad lines of the Communist philosophy of history. In their book they ascribe to the working class a unique mission and special virtues. ""Our class seemed to us to be beautiful in spite of its wounds, rich in authentic human values; never once did we come across a reason to disparage or underestimate it. And the prospects it opens for the history of humanity are too great and too real for the other classes to ignore it"" p. 268. One's way of thinking, they suggest, depends essentially on the class one belongs to. ""By immersing ourselves completely in the proletarian conditions of life, and being constantly and intimately connected with the working masses, a certain number of us have begun to acquire or to regain a new mentality, a new class consciousness. We share the workers' reactions, we see things through their eyes, their mindsfor example the sense of the class struggle for the suppression of classes, the feeling of being inevitably interdependent, the conviction that they cannot free themselves from capitalist exploitation unless they stick together . . . "" p. 207 The proletarian awareness to which these Christians have acceded seems to be entirely moulded by Communist ideology: ""We know now that the proletariat left to itself, without class consciousness, without organisation, will never succeed in defeating an enemy which assails it on every side and which is a hundred times superior, if not in numbers and in quality, at least in means of oppression and repression which range from straightforward brutality to hypocritical benevolence and the narcotic of religion"" p. 23o.  Les Prétres-Ouvriers Paris, Editions du Seuil, 1954, p. 268. And here is an example of the terms in which the worker-priests judge and condemn socialist reformism: ""And in countries where this bourgeois social-democracy resists, it flounders about in a morass of contradictions: repression, injustice, misery, aggressive war, all due to this 'henceforth"
