chapter,chunk,text
13,2,"challenge and societies prove themselves either capable of meeting it or not. The metaphysic of the life-force, in individuals or societies, is simply a question of translating into a concept or an image whatever we experience. The fate of a society is explained by the virtues peculiar to the particular human group. If we seek to establish how this fate was determined, we ask ourselves what likelihood there is that the aptitudes necessary for a successful response to the challenge will manifest themselves another time when the same challenge is repeated. A civilisation born of the clash between an environment and a will is comparable to a lucky draw: rare have been the cases when the environment has given men a chance, or when they were capable of seizing the chance that was offered. The fortuitousness of historical explanation becomes clearer if one places oneself on a somewhat lower plane. Neither the attitude of Louis XVI to the financial crisis and the States-General, nor the attitude of Hitler in 1940 to the continued resistance of Great Britain and the menacing and enigmatic presence of the USSR behind him, was preordained by the circumstances. Another king might have faced up to the crisis, might have used his troops against the Parisian rioters; another dictator might have maintained a state of non-belligerence with the East while increasing his efforts to force the Westerners to sue for peace. Neither the behaviour of Louis XVI nor that of Hitler is unintelligible. One derives from the way of thinking proper to the descendant of an ancient royal line, the other from that of the parvenu demagogue who has won supreme power. But once it is agreedand this surely cannot be deniedthat a king endowed by the hazards of heredity with a different character would have been capable of acting otherwise, the decisions of Louis XVI in relation to the situation acquire an element of chance. Once it is agreed that the strategy finally decided on by Hitler was the result of calculations which, with another dictator or with the same dictator otherwise informed or influenced, might have been different, the development of the Second World War can then be seen as unique and unpredictable. The man who finds himself called upon to take a historical decision expresses his society or his age; but the political or military fortune of that man has never been strictly determined by the social structure taken as a whole. The collapse of the French monarchy and the success of the Revolution opened unlimited prospects to a young, gifted, low-born officer. The career of Bonaparte is typical of the time in which he lived. But no-one could have foreseen that the individual who was to be brought to the summit should have been precisely Napoleon Bonaparte. The fact depended on innumerable causes, positive or permissive, comparable to the innumerable causes which make the roulette ball stop on one number rather than another. The accession of Napoleon to the throne is a lucky draw, among many conceivable others, in the great lottery of revolutions. But the fact that Napoleon, as master of France, conducted a policy which expressed his unique personality and not the tendencies common to crowned adventurers, means that the various circumstances which fed his ambition appear to develop indefinite consequences, at least as long as the institutions of France and Europe continue to bear the imprint of his genius. Men of action love to invoke their star, as though they felt themselves to be playthings of providence, of a malign genius, or of the anonymous and mysterious force that is known as chance. They feel that rational action is merely a question of calculating the chances. The war leader, the politician, the speculator, the business man rarely have a knowledge of the contingencies which allows a strict combination of means with a view to an end. They take a chance, and they cannot but take a chance. The reaction of the enemy is never entirely foreseeable at the moment when one draws up a plan of campaign; the factors on which the success of a parliamentary manoeuvre depends are too numerous to be counted; the stock exchange speculator takes no account of government interventions or political events which might alter the atmosphere of the market; the business man who draws up a programme of investments counts on a phase of expansion. The structural characteristics of human actionthe clash of wills, the complexity of circumstances, chance phenomena and the various causes of deviationare no longer disregarded by sociological theorists. How could they be neglected by those who would understand history? When they refer to the moment of choice, in order to establish the possible choices, they re-enact the deliberation of the original actors, they reconstruct the events as they were lived, not as the unfolding of a necessity but as the explos"
13,3,"ion of the actual. For all that, probability is not strictly objective: decisions relate to situations from which they become detached, great men 'express' their environment, chains of events are never radically distinct. It is the human mind which fails to decipher the contingencies or to exhaust the possible causes. But retrospective calculations of probability correspond to the prospective calculations of the actors. The historical world itself outlines the distinction between mass data the size of populations, the means of production, class oppositions and the actions of individuals, between the unfolding of a necessity and the nodal events before which destiny pauses, the big dates which mark the beginning or the end of an age, the accidents which alter the destiny of a civilisation. The structure of history is sufficiently problematical to allow us to apply the same mode of thought to it. These formal considerations are not intended to magnify the role of great men or the responsibility of historical accidents. The dogmatic denial of that role or that responsibility is nevertheless unthinkable. In each case, one must ask oneself to what extent the man chosen by the political lottery has set his seal on the course of his epoch, whether a defeat has confirmed or provoked the decomposition of a State, whether an event has reflected or distorted the relationship of the various forces or the movement of ideas. The answer will never be black or white, necessity or accident: the work of the hero has been prepared by history, even if another would have given it a different character. Historians are inclined either to minimise or to exaggerate the importance of unforeseeable circumstances or chance occurrences. This tendency cannot be given the status of a philosophy; it reveals a prejudice or a particular orientation of curiosity. A problem which derives from experience and admits of no universally valid solution cannot be settled philosophically. Why should the margin of creation or efficaciousness left to individuals or to accidents be equally wide or equally narrow in every period or in every sector? Events are none-the-less intelligible for being related to the intentions or the feelings of a small group or even of a single man. Whether one attributes a victory to superior fire-power or to the genius of the commander, the explanation becomes neither more nor less satisfying to the mind. Perhaps, as certain military writers affirm, weapons and organisations are ninety per cent responsible, and the rest, the morale and fighting qualities of the troops and the talents of the strategist, ten per cent. That is a question of fact, not of doctrine. The fear that the intervention of fragmentary factsindividual decisions or accidental encounterswill destroy the intelligibility of the whole is quite ill-founded. That the facts, in detail, might have been other than they were does not prevent us from understanding the whole. One would have understood Napoleon's victory ""if it had been Grouchy""; one would have understood the industrialisation of Russia with the help of foreign capital under a progressively liberal Czarist régime basing itself on a class of peasant proprietors, if the war of 1914 had not broken out and if the Bolshevik Party had been eliminated. Whatever the probability one ascribes retrospectively to these hypothesesin the strictest terms, however many data one must modify in one's mind in order to make possible what did not occurthe actual course of events remains intelligible. Lenin's victory was perhaps the inevitable outcome of the Civil War after the collapse of the Czarist régime and the continuation of the war by the provisional government. Inevitable as it was in the particular set of circumstances, the victory of the Bolsheviks perhaps did not bring the blessings which the Russian people expected or which the building up of a modern economy would have produced at lesser cost. The historian who retraces an episode or adventure Napoleon's career between 1798 and 1815, or Hitler's between 1933 and 1945must make the whole intelligible. He does not suggest that at every moment a global determinism reigned. He is tempted to seek the deep, original causes of what finally happened. Napoleon's imperialist undertaking failed because its French basis was too narrow, because the means of communication and administration were unequal to such an enterprise, because the French armies aroused the patriotism of the peoples whose countries they occupied by the contrast between the ideas they propagated and the repressive order they imposed. Hitler's undertaking was doomed because it provoked a coalition between the Soviet Union and the Anglo-Saxon States. Such explanations are valid enough as far"
13,4,"as they go: they indicate the causes which rendered probable the final failure. But these causes did not determine in advance either the detail or the duration of the adventure and did not exclude accidents. A breakdown of the Anglo-Austrian-Russian alliance would have saved Napoleon in 1813, a rupture between the Soviet Union and the Western powers would have saved Hitler's Germany, just as Frederick the Second was saved by the breakdown of the Austro-Russian alliance of his day. For a multitude of reasons, these eventualities were improbable in 1813 and 1944. Destiny might have been reversed by secret weapons, by the perfecting of the atom bomb though there again, for other reasons, such an eventuality was improbable. The concatenation of global facts, which one disentangles at a certain level above the chaos of events and individuals, does not exclude the role of individuals or chance encounters. The intelligible reconstruction of the past has to do with reality; on principle it ignores 'might-have-beens' and is not concerned with necessity. If one poses the question of causality, the answer is always the same: given certain circumstances, what did happen was more likely to happen than not. If, in a game of boule, one of the numbers is considerably bigger than the others, it will come up more often. The determinist interpretation and the contingent vision of the course of history are complementary rather than contradictory. One cannot show the partial truth of the one without taking the other into consideration. Why should the historian deny retrospectively the authenticity of the dramatic events we live through? Man, in history, does not ask himself whether he is the slave of his heredity or of his education, but whether he is capable of leaving traces of his sojourn on this earth. Why should he think up after the event a predestination which the living know nothing of? Theoretical Predictions Historical events are foreseeable precisely to the extent to which they are causally explicable. Past and future are homogeneous: scientific propositions do not change their character according to whichever of the two they are being applied. Why do so many historians tend to regard the past as preordained and the future as indeterminate? In most cases, one cannot foresee the decision an individual will take among several possible decisions, but one makes intelligible the one which has in fact been taken by relating it to the circumstances, to the aims of the actor, to the exigencies of politics or strategy. Retrospective interpretation is always formulated either in terms of factual statement: 'things happen thus . . . ' or hypotheses: 'such a motive was at the origin of such a course of action'. It does not allow us to know what will happen tomorrow, unless it is sufficiently abstract to be applicable to other contingencies: if the act resulted from a durable disposition of the individual or the group, if it was imposed by circumstances, prediction immediately becomes possible because the interpretation implicitly contained a causal relationship. When this relationship appears, the homogeneity of past and future reinstates itself, although it is often concealed by the language used. Since one knows the outcome, one does not hesitate to represent an event as the effect of a single cause, forgetting that effect and cause result from a selection and an arbitrary division. One ignores the variable factors which might have intervened, and one represents as a necessary sequence of events what was valid only 'all things being equal'. After 1942 or 1943, one foresaw Hitler's defeat, just as, looking back, one can perceive how it was determined: the fundamental data of the situation made the outcome of the conflict foreseeable, because, in all probability, inevitable. For the war to have taken another course, an accident of some sortsecret weapons or a breakdown of the anti-German alliancewould have been necessary. Looking to the future, one does not dare to exclude such reversals. One will never succeed in predicting the exact date and the exact circumstances of a particular war. Perhaps, in 1905 or in 1910, a few perspicacious individuals may have perceived that a crisis was brewing which would lead to a European war. They would not have been able to say at what date it would break out or what circumstances would precipitate it. The fundamental data of the situation in 1914 did not imply the explosion and it is therefore not without interest to study the men who, in August, 1914, brought about an event which, at that particular moment, was"
13,5,"no more determined by the European situation than it had been during the course of the preceding years or than it would have been in the following years if the outbreak of war had been avoided then. Beyond this predictability in vague terms or this unpredictability in precise terms, can one establish the causes which make armed conflicts between sovereign States with variable frequency inevitable? One cannot, for the moment, dogmatically affirm or deny the possibility of a theory. War seems to be tied up with too many different social phenomena for one to be able to enumerate all of them. Being a global fact, it reflects the nature of international relations. It would probably be necessary to alter the essence of the latter in order to eliminate the risk of war. Facts relating to populationbirth rate, death rate, age distributionare the most susceptible to prediction: the determining variables are few in number, are not subject to rapid changes of value arid are little affected by external influences. To calculate, on the basis of those already born, the classes which will be available for military service ten or twenty years hence would involve comparatively few risks: the formula 'all things being equal' would in this case amount to disregarding the eventuality of military disasters, epidemics or famines, in other words a sudden modification of the 'expectation of life'. Demographic predictions twenty or fifty years ahead are more chancy, because an evolution does not always continue in the same direction. A fall in the birth rateas one has seen in the case of Franceis liable to be followed by a sudden rise. It is in the economic sector that attempts at prediction are most often made, although it cannot be said that any method is fully satisfactory or capable of achieving incontrovertible results. Short-term prediction, in a national framework, presupposes a knowledge of the principal variables within the system. It rarely involves serious errors, because, short of exceptional circumstances, tendencies do not change abruptly. Prediction could never achieve strict accuracy unless the innumerable circuits through which products pass were known in detail and the variables liable to affect the global movement were determined. In any case it would remain uncertain: human behaviour, in particular the behaviour of business men, obeys collective and unpredictable movements of confidence or mistrust. In logical terms, predictions relating to the trade cycle fall into the same category. In 1953, the experts did not agree on the consequences of the American recession, or even on the circumstances which provoked it. The nature and the significance of an over-all theory in this field are often debated: granted the vulnerability to crisis of a full employment economy, it has nevertheless not been proved that the variable which brings about the reversal of the tendency is always the same, or that a mathematical model can be used. The idea of the snowball of economic expansion or recession is well known, and it may be that the psychology of consumers, business men or ministers may influence the development of a recession which is at first limited. Every crisis has its history. The interdependence of all the variables of an economic system may enable us to elaborate a theory, but the theory does not reveal regularities so much as possible chains of circumstance between which, in each case, events determine the one which actually happens. Whether confirmed or belied, these short or medium term predictions do not raise any question of principle. The scepticism of politicians is just as deplorable as the overconfidence of experts. Through experience, one gets to know just how precise and accurate any forecast can be, and the limits will vary according to the system. These elementary remarks bring us to the real problem which concerns us here: whether the evolution of economic systems, or the transition from one system to another, is predictable. Can one prove that capitalism destroys itself, that socialism must necessarily follow it even though one does not know when and how? The unpredictability of the recent American recession does not imply the unpredictability of long-term historical development. According to the level they take place on, events appear to be determined by calculable causes or subject to innumerable influences. An estimate of the American national income twenty years hence may well be less chancy than an estimate of the production index twenty months hence although the twenty-year prediction presupposes that no unexpected disturbance superveneswhich, in a period of war or revolution, is a very serious reservation. It remains for us to decide whether internal transformations or the collapse of an economic system belong to the category of predictable facts, in other words determined by a few causes with discernible effects. Granted that a system based on the profit motive and the demands of millions of consum"
13,6,"ers is unstable; it nevertheless exists and survives. In order to prove its inevitable self-destruction, one must first specify the circumstances in which it will be disabled, and then show that these circumstances flow irresistibly from the functioning of the régime. The law known as the law of the falling rate of profit represents an attempt of this kind, but it is now no more than a curiosity. It presupposes, in effect, that the profit is taken off the surplus value alonein other words, that portion of the value which corresponds to the cost of labour. One must accept the law of labour value, the Marxist conception of wages and surplus value, and subscribe to the thesis according to which the profit rate decreases in exact ratio to the decrease in the variable portion of the capital. And the establishment of an average profit rate would prevent one from recognising that the replacement of the worker by the machine reduces the possibilities of profit. The fact that so many hypotheses are necessary to reconcile a theory with the facts should persuade one to abandon the theory itself. The law of the falling rate of profit would not justify the belief that capitalism must inevitably destroy itself. There are, indeed, influences which tend to slow down the decline in the profit rate. For example, the reduction of the value of the commodities needed for the maintenance of the worker and his family. In the framework outlined in Das Kapital, the mass of the surplus value increases with the number of workers. We are left in the dark about the speed at which the profit rate decreases, and about the minimum rate necessary for the survival of the system. The fact that there is no genuine theory proving the inevitable downfall of capitalism does not, it is true, tell us anything about its future chances of survival. A theory can usually be reduced to a simplified pattern. Patterns of perpetual harmony are easy to invent liberals never stop inventing them. On the other hand, the pessimists find it difficult to invent patterns which confirm their sombre views: if capitalism were essentially based on a contradictory pattern, it would never have existed. The pessimists are not theorists but historians; they see before their eyes an inevitable decline. Thus the economists who talk of capitalist maturity deem that the development of the American economy has created a situation in which full employment has become, if not impossible, at least difficult. Marx had imagined that the profit motive, the core and the basic principle of the system, tended to dry up the source of profit. There were some economists who, observing the disappearance of frontiers, the slowing down of the birth rate, the decrease in the number of profitable investments as machinery developed, were inclined to fear that the relationship between the marginal utility of capital and the rate of interest might be such that a margin of unemployment would be permanently created. Twenty years ago, the doctrine of 'maturity'the modern version of the self-destruction of capitalismwas very fashionable. Today it is no longer so: the expansion of the American economy has encouraged a more optimistic view. It is not inconceivable that at a certain moment an economy based on the free market might be hamstrung by a reduction in the number of profitable investments. The opportunities for investment created by technological progress might be less frequent and more difficult to exploit than the opportunities typically presented in the initial phases of industrialisationthe construction of roads, railways and motor-car factories. Even on this assumption, economists who do not claim to be prophets do not foresee either the apocalyptic collapse of capitalism or the inevitability of total planning, but simply the necessity of government intervention in the shape of the lowering of the rate of interest or State investments. Does experience suggest that the mechanism of the market is eliminated by planning in proportion as capitalist systems grow older? The Russian economy which, in terms of income per head of population or of capital per worker or of the distribution of labour between the three sectors, is about half a century younger than the American economy, is subject to central planning whereas the latter is not. The distribution of economic systems throughout the world, in the mid-twentieth century, is a historical fact, and has nothing to do with economic maturity.  Personally, I regard the opposite hypothesis as more probable. Given the absence of progress in the tertiary sector, the difficulty, more or less grave according to the different phases, appears to me to be that of the transfer of the means of production, labour in particular. One can see no decisive reason why the functioning of the system should, at a certain"
