chapter,chunk,text
8,4,"class only to the extent that it acquires a unity and this can only result from opposition to the other classes. In short, the proletariat is its struggle against society. Jean-Paul Sartre, in his more recent writings, proceeds from this authentically Marxian idea that the proletariat only becomes united through opposition to the other classes, and concludes that an organisation, that is a party, is essential. Implicitly, or surreptitiously, he identifies the proletarian party with the Communist Patty, in such a way that he turns to the latter's advantage the arguments which merely demonstrate the need for a party to defend the interests of the workers. Moreover, it is impossible to say whether the argument holds for the French proletariat of 1955, the French proletariat over the past two centuries, or for all proletariats inside capitalist régimes. To return to more prosaic considerations: if one agrees to call all industrial workers proletarians, what are the aspects of their condition against which they rebel? What aspects would a revolution suppress? In concrete terms, what would the triumph of a 'deproletarianised' working class involve? In what way would the victorious workers, no longer 'alienated', differ from those of today? Real and Ideal Emancipation The proletarian, we are told by Marx and the writers who echo him, is 'alienated'. He possesses nothing but his labour-power which he sells in the market to the owner of the instruments of production. He is enclosed in the narrow confines of his job and receives, as the price of his labours, a wage which is just sufficient to maintain himself and his family. According to this theory, private ownership of the means of production is the ultimate cause both of oppression and exploitation. Deprived of the surplus-value which is accumulated by the capitalists alone, the worker is stripped, so to speak, of his humanity. These ideas remain in the background of Marxist thought. It is not easy to put them very explicitly. The key to the argument, in Das Kapital, is the conception according to which the worker's wage, like any commodity, has a value which is determined by the needs of the worker and his family. Now, either this conception is interpreted in the strictest sense, in which case it is undeniably confuted by the raising of salaries in the West: or it is interpreted in the widest sensethe incompressible needs of the workers evolve from the collective psychologyand in this case the conception itself no longer tells us anything. In the middle of the twentieth century the worker's wage in the United States can allow the purchase of a washing machine or a television set. Das Kapital has been little read in France, and French writers seldom refer to it. But it is not so much ignorance of the economic theorems of Marx which weakens the analysis of working-class alienation as the realisation that many of the workers' grievances have nothing to do with the pattern of ownership, that they subsist just the same when the means of production belong to the State. Let us enumerate the basic grievances: 1 inadequate pay; 2 excessive working hours; 3 the threat of unemployment; 4 discontent arising from the technical and administrative organisation of the factory; 5 the feeling of being in a rut with no possibility of advancement; 6 the consciousness of being the victim of a basic injustice, in that the system either does not allow the worker a fair share of the national wealth or refuses him any part in the management of the economy. Marxist propaganda is at pains to foster the awareness of a basic injustice and to confirm it by the theory of exploitation. Such propaganda does not succeed in every country. In countries where the immediate claims of the workers are to some extent satisfied, the indictment of the régime takes on the appearance of a sterile radicalism. On the other hand, in countries where these claims are not satisfied, or are satisfied too slowly, the temptation to blame the régime is liable to become irresistible. The Marxist interpretation of proletarian misery cannot but appear convincing to the proletarian. The cruelties and hardships arising from the wage system, from poverty, technology, the threat of unemployment, the lack of futurewhy not put it all down to capitalism since this vague word covers both the 'relations of production' and the method of distribution? Even in the countries where working conditions have been most improved, in the United States where private enterprise is"
8,5,"in general accepted, there is still a prejudice against profit-making, a latent suspicion, always ready to spring to the surface, that the capitalist or the limited company, as such, exploit their workers. The Marxist interpretation accords with the outlook on society to which the workers spontaneously subscribe. In fact, the level of salaries in the West depends, one knows, on productivity, on the division of the national income between investments, military expenditure and consumption, and the distribution of incomes among the various classes. This distribution is no more egalitarian in a régime such as that of Soviet Russia than in a capitalist or semi-capitalist régime. The proportion taken up by investments is greater on the other side of the Iron Curtain; there, economic expansion has contributed to the growth of power rather than to the raising of the standard of living. There is no proof that collective ownership is more conducive to increased productivity than private ownership. A diminution in working hours has proved itself compatible with capitalism. On the other hand, the threat of unemployment remains one of the evils of any economic system which is based on the free market. Unless one eliminates the fluctuations of the trade cycle or accepts permanent inflation, any economy based on the free hire of labour involves a risk of at least temporary unemployment. There is no point in denying this drawback; its effects must be reduced as far as possible. As regards the psychological problems of factory work, industrial psychologists have analysed their various causes and effects and suggested methods likely to alleviate fatigue or boredom, to smooth over personal relations and to cure grievances and recriminations, and to integrate the workers into the communal life of the workshop or factory. The application of such methods is not the exclusive property of any one political system, whether capitalist or socialist. The weakness of private ownership in this respect is that the challenging of the capitalist system as such incites many workers and intellectuals to denounce the application of scientific teachings for socially conservative ends. Has the character of the régime any bearing on the workers' chances of promotion? This is not an easy question; comparative studies of mobility are too imperfect to allow a categorical answer. In a general sense, advancement becomes easier as the proportion of non-manual jobs increases. Economic growth is in itself a factor tending towards mobility. The disappearance of caste prejudices in bourgeois democratic countries should accelerate this process. In the Soviet Union, the liquidation of the old aristocracy and the rapidity of industrialisation have greatly increased the chances of promotion. Finally, there remains the fact that if capitalism, defined as the private ownership of the means of production and the mechanism of the market, is the source of all evil, all reforms should be condemned because they threaten to prolong the life of an odious system. On the basis of these summary and fairly obvious remarks, there is no difficulty in distinguishing two forms of working class emancipation. The first, which is never finally completed, consists of a multiplicity of partial and ad hoc measures: the remuneration of the workers rises as productivity rises, social legislation protects families and the old, trade unions freely discuss conditions of work with the employers, and the extension of education increases the chances of promotion. This form of emancipation can be called real emancipation: it is characterised by concrete improvements in the condition of the proletariat, it leaves certain grievances, especially unemployment, and it cannot entirely eliminate opposition on the part of a minority, big or small, to the principles of the régime itself. A revolution on the Soviet model gives absolute power to the minority which claims to represent the proletariat and transforms many workers or sons of workers into engineers or commissars. Does this mean that the proletariat itself, that is to say the millions who work with their hands in factories, is 'emancipated'? The standard of living has not suddenly leapt up in the People's Democracies of Eastern Europe; rather has it diminished, since the new ruling classes probably do not consume any less of the national wealth than the old. Where there existed free trade unions, there are now only bodies which are subject to the State and whose function is to incite to effort, not to fight for the workers' rights. The risk of unemployment has disappeared, but so have the free choice of job or of place of work and the free election of union leaders and governments. The proletariat is no longer alienated, because it is theoretically the ultimate owner of the"
8,6,"means of production and even of the State. But it has not been freed from the risk of deportation, or from the tyranny of the labour permit, or from the authority of the managers. Does this mean that the second form of emancipation, which one might call ideal emancipation, is illusory? Do not let us be carried away by polemics. We have seen that the proletariat is inclined to interpret society as a whole according to the ideas of Marxist philosophy: it believes itself to be the victim of the boss, when in fact it is mainly the victim of low productivity. But however erroneous this judgment may be, it is none-the-less authentic. With the suppression of the capitalists and their replacement by State managers, with the inauguration of a plan, everything becomes clear. Inequalities of pay are accepted as the natural consequence of the varying importance of different functions, decline in consumption as the inevitable accompaniment of increased investment. The proletariat, at least a fair proportion of it, finds it easier to accept the Zis of the manager appointed by the State than the Packard of the private boss. It does not protest against privations because it is persuaded of their necessity for the future. Those who believe in the ultimate achievement of the classless society, however far ahead, will feel themselves to be associated, through their very sacrifices, with a great and noble task. This ideal emancipation the Marxists would call real because it is defined by an ideology: private ownership is the source of all alienation and the wage-earner, instead of being 'particularised' by working in the service of an entrepreneur, becomes 'universalised', under a Soviet-type régime, through his participation in the community, and free since he submits himself freely to the necessity represented by the industrialisation plans which accord with the demands of a history determined by inflexible laws. Whoever denounces capitalism, by definition prefers planning with its political severities to the mechanism of the market with its unpredictable fluctuations. The Soviet régime places itself in the context of history. It wants to be judged not so much on what it is as on what it will be. The continued low standard of living throughout the first Five-Year Plans is justified not by dogma but by the necessity of building up the military and economic strength of the Soviet Union, threatened from the outside. The 'ideal' emancipation, once the Socialist State is securely established, will approximate more and more to the 'real' emancipation. None of the theorists of Bolshevism had foreseen, before the seizure of power, that the trade unions would be gleich-geschaltet by the Socialist State. Lenin was alone in realising that there was a danger of the so-called proletarian State repeating the misdeeds of the bourgeois State and he had pleaded in advance the cause of independent trade unionism. The dislocation of the economy after the civil war and the militaristic methods adopted by Trotsky and the Bolsheviks in order to fight their enemies caused them to forget their former liberal ideas. Of course it is said today that strikes and opposition and wage demands no longer have any sense since the State is proletarian. Criticism of bureaucracy remains legitimate and necessary. Privately, according to the esoteric doctrine, the extension of the right to criticise is envisaged when the process of building up the Socialist State has reached such a stage as to allow a relaxation of discipline. Once the régime is no longer questioned, the unions, like those of Britain or America, would defend the interests of the workers against the exactions of the managers. The function of protecting the workers' rights would gradually be added to the function of organising the workers, as in every other industrial society. Even if one accepts the validity of this long-term optimism, why should the Western countries which went through the development phase corresponding to the first Five-Year Plans a century ago, sacrifice 'real' to 'ideal' emancipation? In countries where the capitalist or semi-capitalist regime is weak, the same argument will be invoked as in the underdeveloped regions: only the unconditional authority of a homogeneous group which has become the master of the State can break down the resistance of the reactionaries or the big landowners and impose a collective economy. In countries where the economy continues to expand, where the standard of living has risen, why should the real liberties of the proletariat, however partial, be sacrified to a total liber"
8,7,"ation which turns out to be indistinguishable from the omnipotence of the State? Perhaps, in the latter case, workers who have not experienced syndicalism or Western socialism are given a sensation of progress. In the eyes of the East German or Czech workers, who have known real liberties, 'ideal' emancipation is nothing but a hoax. The Attraction of Ideal Emancipation When the majority of the proletariat is led by men who are dedicated to real emancipation, left-wing intellectuals need have no pangs of conscience. Perhaps they are unconsciously disillusioned by the attitude of the workers, who are more susceptible to immediate gains than to grandiose visions. Artists and writers have seldom been inspired by the British Labour movement or by Swedish syndicalism, and they are certainly right not to waste their time studying achievements which, however admirable, are not worthy of the consideration of superior minds. In Great Britain, the leaders of the Labour movement who are of working-class origin usually show more moderation than those who have graduated from the intellectual professions. Aneurin Bevan is an obvious exception, and it is not surprising that he is surrounded by intellectuals and that the trade union leaders are among his principal adversaries. In France it is quite otherwise. There, an important part of the working class votes for the Communist Party, the leaders of the most influential trade unions are Party members, and reformism is regarded as sterile. This is the source of the contradiction which at once torments and fascinates existentialists, left-wing Christians and 'progressives' of every sort: how can they bring themselves to break away completely from the party which represents the proletariat, and how can they give their allegiance to a party which is more interested in serving the interests of the Soviet Union than those of the French working class? Put in rational terms, the problem allows of a variety of solutions. If one considers that the Soviet Union, in spite of everything, represents the cause of the proletariat, one joins the Communist Party or co-operates with it. If, on the other hand, one considers that 'real' emancipation has a better chance of success in the West or that, coexistence being the only means of ensuring peace, France must remain, as she is geographically, on the side of the bourgeois democracies, one tries to wean the unions away from the control of those who have quite sincerely put themselves in the service of Moscow. Finally, one can look for a middle waysocialism at home, neutrality abroad, but without a break with the West. None of these decisions should demand metaphysical ratiocination; none need transform the intellectual into an enemy of the proletariaton one condition: that the decision is made in the light of historical reality and not on the basis of the Marxian prophetism. Unfortunately, both existentialists and 'progressive' Christians refuse to see reality except through this messianic spectroscope. The wish for solidarity with the proletariat is proof of generous feelings, but it scarcely helps one to orientate oneself in the world. In the mid-twentieth century, there is no such thing as a world proletariat. If one supports the party of the Russian proletariat, one is against that of the American proletariat, unless one regards the few thousand Communists, the Negro or Mexican sub-proletariats, as the representatives of the American working class. If one supports the Communist-dominated French trade unions, one is against the German trade unions which are almost unanimously anti-Communist. If one bases oneself on the votes of the majority, one would have had to be Socialist in France in the 'thirties and Communist in the 'fifties, one would be a Labour supporter in England and a Communist supporter in France. The millions of manual labourers do not spontaneously share a united opinion or a united will. According to country or circumstance, they incline towards violence or towards resignation. The authentic proletariat is not defined by the actual experience of the industrial workers, but by a theory of history. How is it that philosophers, who claim to be interested in the concrete, can reaffirm, in the middle of the twentieth century and after two World Wars, the Marxian prophetism concerning the proletariatespecially in a country like France which has more peasants and petty bourgeois than proletarians? Sartre's itinerary towards quasi-Communism appears to be dialectical. Man being a"
8,8,"'vain passion', one is inclined in the last analysis to judge the various 'projects' as all equally sterile. The radiant vision of the classless society follows on the description of the squalid society of today, just as, in the novels of the naturalist school, political optimism was cheerfully combined with the depiction of human basenessthe little blue flower of the future on the dunghill of the present. The existentialist technique of psychology, like the Marxist criticism of ideologies, undermines doctrines by unmasking the sordid interests concealed behind the façade of verbal generosity. There is a risk that this method may lead to a sort of nihilism: why should our own convictions be any purer than those of others? The recourse to an arbitrary decision of the will, either individual or collective, in the Fascist style, offers one way out of this universal negation; the 'lived intersubjectivity' of the proletariat or the law of history offers another. Finally, in the last resort, the philosophy of the existentialists is morally inspired. Sartre is obsessed by the desire for authenticity, for communication, for freedom. For him, any situation which inhibits the exercise of freedom is contrary to man's predestined purpose. The subordination of one individual to another falsifies the dialogue between minds and consciences which are equal because equally free. Ethical radicalism, combined with ignorance of social structures, predisposed him to verbal revolutionism. Hatred of the bourgeoisie makes him allergic to prosaic reforms: the proletariat must not be allowed to compromise with the 'swine' who are confident of the strength of their vested interests. Thus we have the strange spectacle of a philosopher and a sceptic reintroducing the myth of the vocation of the working class, without apparently being aware of any contradiction in his attitude. The case of the 'progressive' Christians is different and their moral conflict is often a moving one. It is difficult for a non-Catholic to broach this subject without being accused of hypocrisy or bigotry. The measures taken against the worker-priests had a profound effect on many Christians; they were also exploited by men who were quite indifferent to religion and who seized the opportunity of discrediting the Church and at the same time boosting the cause of fellow-travelling by quoting men whose political acumen, if not their spiritual quality, was open to doubt. The primary fact which must be taken into account in order to understand the attitude of the 'progressive' Christians is the bond between a large number of French proletarians and the Communist Party. Thus, the author of Jeunesse de l'Eglise writes: ""There could be no hope of the influence of the Church being usefully exercised for the general good if our view of the working-class world where it must be made to take root remained abstract and distorted, however convenient it might seem. We must, therefore, however much it may cost us, face up to the bitter reality: that is to say we must acknowledge as a fact the organic connection between Communism and the working class as a whole. "" But why this organic connection? The author of the book does not invoke historical explanationsthe merger of the unions at the time of the Popular Front, the Resistance, Communist infiltration at the time of the Liberationhe gives reasons which, if literally interpreted, would apply everywhere and always. The Communist Party ""has discovered as it were scientifically the causes of the oppression which weighs upon the working class""; and it has organised this class which would otherwise be prone to spontaneous violence ""for an action whose final success, however distant, is more important than immediate and partial results""; and finally it has given the working-class population ""a philosophy which Jean Lacroix has described in a penetrating phrase as the immanent philosophy of the proletariat"".  Les Evénements et la Foi, 1940-1952 Paris, Editions du Seuil. 1951. ""What we seek"", this writer tells us, ""what we seek passionately, for if we do not find it we will sink into despair, is a new and healthy historical force, preserved from all the squalid double-dealing of the past and capable of accomplishing what the others have been content to think about and make use of for their own ends. And this force does exist: we have come across its solid, palpable form and recognised its potentialities the closer events have brought us to the people"
